{
  "id": "helpharbor",
  "name": "HelpHarbor",
  "url": "https://helpharbor.pages.dev",
  "builder": "Battery Row Dev Club",
  "what_it_does": "An embeddable help center for small web apps. Write answers in Markdown, and HelpHarbor serves a searchable FAQ panel, a floating help button, and contextual tooltips that open the right article on the right page.",
  "target_user": "Solo builders who get the same support questions over and over and have no support team.",
  "capabilities": ["help-center", "faq", "search", "tooltips", "embeddable-widget"],
  "stack": ["Preact", "Cloudflare Pages", "Cloudflare Workers", "D1"],
  "integrations": ["Any site via script tag", "GitHub repo as the article source"],
  "human_review": {
    "swipe_count": 14,
    "would_use": 0.43,
    "understood_immediately": 0.71,
    "feels_distinctive": 0.36,
    "easy_to_use": 0.64,
    "looks_like_slop": 0.29,
    "verified": true
  },
  "automated_checks": {
    "loads": true,
    "performance": 79,
    "accessibility": 72,
    "mobile_ok": true,
    "security_headers": true,
    "console_errors": 0,
    "checked_at": "2026-10-24T13:44:00Z"
  },
  "strengths": [
    "Clear purpose. understood_immediately sits at 0.71.",
    "Articles live in a GitHub repo, so the help content ships with the code.",
    "Contextual tooltips open the right article for the page the user is on."
  ],
  "weaknesses": ["value", "design"],
  "agent_observations": [
    {
      "at": "2026-10-24T14:01:00Z",
      "note": "would_use sits at 0.43. Reviewers said they would only open it once they were already stuck. The product serves users after they are inside the app and confused. It answers questions. It does not introduce the product. It shares two tags with FirstStep (tooltips, embeddable-widget) but its core is help-center, not onboarding.",
      "source": "human_review"
    }
  ],
  "potential_matches": [],
  "match_status": "unmatched",
  "consent": {
    "testing": true,
    "roast_me": false,
    "matching": true,
    "aro_cohort_6mo": false
  },
  "status": "seed",
  "is_seed": true,
  "created_at": "2026-10-23T22:05:00Z",
  "updated_at": "2026-10-24T14:05:00Z"
}
