{
  "id": "porchlight",
  "name": "Porchlight",
  "url": "https://porchlight-lowcountry.pages.dev",
  "builder": "Daniel Island Hack Club",
  "what_it_does": "Volunteer matching for Lowcountry nonprofits. Volunteers pick causes and free hours, and Porchlight lists nearby shifts from food banks, river cleanups, and animal shelters with one-click signup.",
  "target_user": "Charleston residents who want to volunteer but do not know which nonprofits need help this week.",
  "capabilities": ["volunteer-matching", "events", "search", "email"],
  "stack": ["Vue", "Firebase"],
  "integrations": ["Google Maps", "Mailchimp"],
  "human_review": {
    "swipe_count": 5,
    "would_use": 0.6,
    "understood_immediately": 0.8,
    "feels_distinctive": 0.4,
    "easy_to_use": 0.7,
    "looks_like_slop": 0.4,
    "verified": true
  },
  "automated_checks": {
    "loads": true,
    "performance": 77,
    "accessibility": 88,
    "mobile_ok": true,
    "security_headers": true,
    "console_errors": 0,
    "checked_at": "2026-10-24T13:40:00Z"
  },
  "strengths": ["understood_immediately", "accessibility", "volunteer-matching"],
  "weaknesses": ["differentiation"],
  "agent_observations": [
    {
      "at": "2026-10-24T13:51:00Z",
      "note": "Porchlight is clear and accessible, but reviewers said it feels like other volunteer boards (feels_distinctive 0.4). It needs a reason to exist beyond a list of shifts.",
      "source": "human_review"
    }
  ],
  "potential_matches": [],
  "match_status": "unmatched",
  "consent": { "testing": true, "roast_me": false, "matching": true, "aro_cohort_6mo": false },
  "status": "seed",
  "is_seed": true,
  "created_at": "2026-10-24T13:34:00Z",
  "updated_at": "2026-10-24T13:51:00Z"
}
