{
  "id": "sweetgrass-market",
  "name": "Sweetgrass Market",
  "url": "https://sweetgrass-market.pages.dev",
  "builder": "Highway 17 Collective",
  "what_it_does": "A direct marketplace for Lowcountry sweetgrass basket makers. Makers list pieces with photos and provenance, buyers browse by form and size, and order requests go straight to the maker by text so nothing sits behind a platform account.",
  "target_user": "Sweetgrass basket makers along Highway 17 in Mount Pleasant and buyers who want to purchase directly from them.",
  "capabilities": ["marketplace", "vendor-profiles", "search", "order-requests", "sms-notifications"],
  "stack": ["Astro", "Cloudflare Pages", "Supabase", "Twilio"],
  "integrations": ["Twilio SMS", "Cloudflare Images"],
  "human_review": {
    "swipe_count": 21,
    "would_use": 0.71,
    "understood_immediately": 0.86,
    "feels_distinctive": 0.9,
    "easy_to_use": 0.62,
    "looks_like_slop": 0.1,
    "verified": true
  },
  "automated_checks": {
    "loads": true,
    "performance": 62,
    "accessibility": 54,
    "mobile_ok": true,
    "security_headers": false,
    "console_errors": 2,
    "checked_at": "2026-10-24T13:48:00Z"
  },
  "strengths": [
    "Highest feels_distinctive in the pool at 0.90. Reviewers recognized the makers and the baskets.",
    "Understood immediately by 86 percent of reviewers.",
    "Order requests reach the maker by text, which matches how the makers already sell."
  ],
  "weaknesses": ["security", "stability"],
  "agent_observations": [
    {
      "at": "2026-10-24T14:03:00Z",
      "note": "Human review is strong across every metric. The gaps are all in automated checks: security_headers failed and the console logs 2 errors on the listing page. No product in the current pool carries a security or stability tag. Do not force a match. Report the gap and wait for the pool to grow.",
      "source": "automated_checks"
    }
  ],
  "potential_matches": [],
  "match_status": "unmatched",
  "consent": {
    "testing": true,
    "roast_me": false,
    "matching": true,
    "aro_cohort_6mo": true
  },
  "status": "seed",
  "is_seed": true,
  "created_at": "2026-10-24T02:45:00Z",
  "updated_at": "2026-10-24T14:05:00Z"
}
