{
  "id": "firstrun",
  "name": "FirstRun",
  "url": "https://firstrun.pages.dev",
  "builder": "Two Bridges Labs",
  "what_it_does": "Drop-in onboarding engine for web apps. Add one script tag and FirstRun reads the page, generates a three-step guided tour, and shows contextual tooltips the first time a user meets each feature. Tracks where new users drop off.",
  "target_user": "Small product teams and hackathon builders who ship a working app but have no time to design a first-run experience.",
  "capabilities": ["onboarding", "guided-tours", "contextual-help", "activation-analytics"],
  "stack": ["Vanilla JS", "Cloudflare Workers", "Claude API"],
  "integrations": ["Any web app via script tag", "PostHog"],
  "human_review": {
    "swipe_count": 7,
    "would_use": 0.71,
    "understood_immediately": 0.86,
    "feels_distinctive": 0.64,
    "easy_to_use": 0.88,
    "looks_like_slop": 0.14,
    "verified": true
  },
  "automated_checks": {
    "loads": true,
    "performance": 92,
    "accessibility": 47,
    "mobile_ok": true,
    "security_headers": true,
    "console_errors": 0,
    "checked_at": "2026-10-24T13:40:00Z"
  },
  "strengths": ["onboarding", "understood_immediately", "easy_to_use", "performance"],
  "weaknesses": ["accessibility"],
  "agent_observations": [
    {
      "at": "2026-10-24T13:45:00Z",
      "note": "FirstRun is the easiest product in the pool to understand (0.86) and its whole job is onboarding. It has no product of its own to onboard into, so it is most useful attached to another build.",
      "source": "human_review"
    }
  ],
  "potential_matches": [],
  "match_status": "unmatched",
  "consent": { "testing": true, "roast_me": false, "matching": true, "aro_cohort_6mo": true },
  "status": "seed",
  "is_seed": true,
  "created_at": "2026-10-24T13:31:00Z",
  "updated_at": "2026-10-24T13:45:00Z"
}
